title,score,num_comments,created_utc,url,subreddit
r/MSFT Lounge,2,49,1629488863.0,https://www.reddit.com/r/MSFT/comments/p8ci4r/rmsft_lounge/,MSFT
$MSFT has been quietly tightening over the past few months... A lot of energy built up here waiting to be released. 🍋,3,0,1732639719.0,https://i.redd.it/3xycfb7gz93e1.jpeg,MSFT
MSFT and open Ai,1,0,1731689905.0,https://www.reddit.com/r/MSFT/comments/1gs0y6f/msft_and_open_ai/,MSFT
"$MSFT Microsoft 'Til Death Do Us Part 🪦 First 50/200 downside cross since March 2022, price fell another -30% from there",1,0,1730607068.0,https://i.redd.it/vxrkgjcl2myd1.jpeg,MSFT
Microsoft Connector Stop Map,2,0,1728605277.0,https://www.reddit.com/r/MSFT/comments/1g0x19p/microsoft_connector_stop_map/,MSFT
$MSFT IS A BUY,4,0,1711037637.0,https://i.redd.it/3jmkcvddpppc1.jpeg,MSFT
I’ve got a question for you…..If I short $NFLX the next two years,1,0,1708412012.0,https://i.redd.it/vf6qrlf1uojc1.jpeg,MSFT
Microsoft Quantum: Play The Long Game,1,0,1696595542.0,https://youtu.be/aQoJjvvIFbk,MSFT
"Satya Nadella on LinkedIn: Announcing Microsoft Copilot, your everyday AI companion - The Official… - The Finance Headline",2,0,1695480479.0,https://thefinanceheadline.com/satya-nadella-on-linkedin-announcing-microsoft-copilot-your-everyday-ai-companion-the-official/,MSFT
Would Microsoft Stock MSFT Be Good For Your Portfolio?,1,0,1690409469.0,https://youtube.com/watch?v=4By9rPej17U&feature=share,MSFT
Microsoft is now leader in AI and Power BI,4,55,1670819783.0,https://www.reddit.com/r/MSFT/comments/zjn6tn/microsoft_is_now_leader_in_ai_and_power_bi/,MSFT
"I’m bearish for next week, stock seems toooooooo hot today!",2,6,1629489263.0,https://www.reddit.com/r/MSFT/comments/p8cmjk/im_bearish_for_next_week_stock_seems_toooooooo/,MSFT
Join my discord! We talk about everything really and I’m looking for more stockbois to join!,1,0,1629489052.0,https://www.reddit.com/r/MSFT/comments/p8ck8z/join_my_discord_we_talk_about_everything_really/,MSFT
"Welcome to MSFT, The community for Microsoft stock!",1,4,1629488994.0,https://www.reddit.com/r/MSFT/comments/p8cjmj/welcome_to_msft_the_community_for_microsoft_stock/,MSFT
MSFT CALL PRINTING!,1,2,1629488921.0,https://i.redd.it/1o3ezygnhki71.jpg,MSFT
