title,score,num_comments,created_utc,url,subreddit
Was the TWTR bid by Elon just a way to hide a massive sale of TSLA Stock?,3841,746,1657650514.0,https://www.reddit.com/r/stocks/comments/vxi1zm/was_the_twtr_bid_by_elon_just_a_way_to_hide_a/,stocks
The absurdity of Elon Musk's poll to decide to sell TSLA stocks,3102,1074,1636315429.0,https://www.reddit.com/r/stocks/comments/qowk4z/the_absurdity_of_elon_musks_poll_to_decide_to/,stocks
"If you were down 5 figures on a stock but you'd buy it at its current price, would you double down? [TSLA]",353,624,1710355624.0,https://www.reddit.com/r/stocks/comments/1bdzb87/if_you_were_down_5_figures_on_a_stock_but_youd/,stocks
"Tesla, Inc. (TSLA) Stock Review 12/24/22",276,342,1671890858.0,https://www.reddit.com/r/stocks/comments/zuaium/tesla_inc_tsla_stock_review_122422/,stocks
What happens to TSLA is Elon goes through with selling $20B in stocks? https://twitter.com/elonmusk/status/1457064697782489088?s=21,281,424,1636247338.0,https://www.reddit.com/r/stocks/comments/qodtru/what_happens_to_tsla_is_elon_goes_through_with/,stocks
"
Tesla shares drop 6% in premarket after Cybercab robotaxi reveal fails to impress",1702,565,1728649167.0,https://www.reddit.com/r/stocks/comments/1g18fon/tesla_shares_drop_6_in_premarket_after_cybercab/,stocks
"Tesla stock downgraded to Sell, analysts say 'not much to like'",2062,463,1721994420.0,https://www.reddit.com/r/stocks/comments/1ecm2et/tesla_stock_downgraded_to_sell_analysts_say_not/,stocks
"10 Tesla Investors Lose $132.5 Billion From Musk's Twitter Fiasco. Interestingly, Musk sold $3.5 billion in tsla stock from 12-14.",323,127,1671120995.0,https://www.reddit.com/r/stocks/comments/zmp0uv/10_tesla_investors_lose_1325_billion_from_musks/,stocks
TSLA might be the most undervalued AI play in the stock market. ,0,94,1718667498.0,https://www.reddit.com/r/stocks/comments/1dich6k/tsla_might_be_the_most_undervalued_ai_play_in_the/,stocks
Tesla net income and earnings drop more than 20% from last year,3458,870,1681935275.0,https://www.reddit.com/r/stocks/comments/12s8m77/tesla_net_income_and_earnings_drop_more_than_20/,stocks
Bill Gates has half a billion dollar short position against Tesla,5383,1091,1650717524.0,https://www.reddit.com/r/stocks/comments/ua4jpu/bill_gates_has_half_a_billion_dollar_short/,stocks
It's not just me right?,6959,2766,1616615045.0,https://www.reddit.com/r/stocks/comments/mceprg/its_not_just_me_right/,stocks
To all of you who are red this year while the S&P500 is up 30%,5852,1156,1640809337.0,https://www.reddit.com/r/stocks/comments/rrhoka/to_all_of_you_who_are_red_this_year_while_the/,stocks
Elon Musk Sells Nearly $7 Billion Worth of Tesla Stock; just months earlier he planned no further Tesla stock sales,4205,852,1660096741.0,https://www.reddit.com/r/stocks/comments/wkl559/elon_musk_sells_nearly_7_billion_worth_of_tesla/,stocks
TSLA hits $1000. Makes it a first $1T Auto company,5491,1226,1635185772.0,https://www.reddit.com/r/stocks/comments/qfmugy/tsla_hits_1000_makes_it_a_first_1t_auto_company/,stocks
"I made $500,000 trading stocks and options in 18 months. These are the 15 things I did that worked best.",7927,718,1635500383.0,https://www.reddit.com/r/stocks/comments/qi92fg/i_made_500000_trading_stocks_and_options_in_18/,stocks
Tesla hit $694 today. The first time below $700 since August 2021,4067,1028,1652972272.0,https://www.reddit.com/r/stocks/comments/ut5a4v/tesla_hit_694_today_the_first_time_below_700/,stocks
Tesla stock DOWNGRADED to a SELL,1189,310,1722112395.0,https://www.reddit.com/r/stocks/comments/1edpwf5/tesla_stock_downgraded_to_a_sell/,stocks
Elon Musk tells Twitter staff he sold Tesla stock to save the social network,3035,624,1668136285.0,https://www.reddit.com/r/stocks/comments/yrzodf/elon_musk_tells_twitter_staff_he_sold_tesla_stock/,stocks
"Tired of hearing about GME, AMC, & NOK? I handpicked the most popular posts, tickers, and DD from the last week. Here are the results!",6822,752,1612791295.0,https://www.reddit.com/r/stocks/comments/lfbw0s/tired_of_hearing_about_gme_amc_nok_i_handpicked/,stocks
